{
  "from_snapshot_id": "snapshot-a",
  "to_snapshot_id": "snapshot-b",
  "persona_id": "p",
  "inventory_delta": { "created": [], "deleted": [], "persisted": [], "untrackable": [] },
  "update_delta": { "same_library_id_changed_recipe": [] },
  "distribution_delta": {
    "appeal": {
      "from_count": 4,
      "to_count": 4,
      "confidence_floor": "high",
      "values": {
        "price": { "from": 0.75, "to": 0.25, "delta": -0.5, "support_count": 4 },
        "quality_proof": { "from": 0.25, "to": 0.75, "delta": 0.5, "support_count": 4 }
      }
    },
    "funnel_stage": {
      "from_count": 4,
      "to_count": 4,
      "confidence_floor": "high",
      "values": {
        "conversion": { "from": 0.75, "to": 0.25, "delta": -0.5, "support_count": 4 },
        "consideration": { "from": 0.25, "to": 0.75, "delta": 0.5, "support_count": 4 }
      }
    }
  },
  "coverage_flags": []
}

